{"acls":[{"operation":"Write","principal":"cp6-p09-probe-publisher","resourceName":"cp6.platform.deployment-probe.v1","resourceType":"Topic"},{"operation":"Describe","principal":"cp6-p09-probe-publisher","resourceName":"cp6.platform.deployment-probe.v1","resourceType":"Topic"},{"operation":"Read","principal":"cp6-p09-probe-receiver","resourceName":"cp6.platform.deployment-probe.v1","resourceType":"Topic"},{"operation":"Describe","principal":"cp6-p09-probe-receiver","resourceName":"cp6.platform.deployment-probe.v1","resourceType":"Topic"},{"operation":"Read","principal":"cp6-p09-probe-receiver","resourceName":"cp6-p09-probe-receiver-v1","resourceType":"Group"},{"operation":"Create","principal":"cp6-p09-provisioner","resourceName":"cp6.platform.deployment-probe.v1","resourceType":"Topic"},{"operation":"Alter","principal":"cp6-p09-provisioner","resourceName":"cp6.platform.deployment-probe.v1","resourceType":"Topic"},{"operation":"Describe","principal":"cp6-p09-provisioner","resourceName":"cp6.platform.deployment-probe.v1","resourceType":"Topic"},{"operation":"Describe","principal":"cp6-p09-provisioner","resourceName":"kafka-cluster","resourceType":"Cluster"}],"checks":[{"id":"profile-valid","result":"Passed","summary":"profile-valid"},{"id":"provision-first","result":"Passed","summary":"provision-first"},{"id":"provision-idempotent","result":"Passed","summary":"provision-idempotent"},{"id":"invoke-positive","result":"Passed","summary":"invoke-positive"},{"id":"pubsub-positive","result":"Passed","summary":"pubsub-positive"},{"id":"direct-kafka-denied","result":"Passed","summary":"direct-kafka-denied"},{"id":"principal-denied","result":"Passed","summary":"principal-denied"},{"id":"appid-scope-denied","result":"Passed","summary":"appid-scope-denied"},{"id":"foreign-topic-denied","result":"Passed","summary":"foreign-topic-denied"},{"id":"kubernetes-render","result":"Passed","summary":"kubernetes-render"},{"id":"kubernetes-policy","result":"Passed","summary":"kubernetes-policy"},{"id":"zero-residue","result":"Passed","summary":"zero-residue"}],"completedUtc":"2026-08-30T00:01:00Z","composeManifestSha256":"aaaaaaaaaaaaaaaaaaaaaaaaaaaaaaaaaaaaaaaaaaaaaaaaaaaaaaaaaaaaaaaa","kubernetesManifestSha256":"bbbbbbbbbbbbbbbbbbbbbbbbbbbbbbbbbbbbbbbbbbbbbbbbbbbbbbbbbbbbbbbb","overall":"Passed","packageVersion":"0.9.0-alpha.1","platformGitSha":"cccccccccccccccccccccccccccccccccccccccc","profileId":"cp6-platform-p09-ci-v1","profileSha256":"94addf0349ff895f21eca3e0d660c8d5159198267080df9109ff6493c1063681","repositoryVersion":"0.9.0.0","runtime":{"daprImage":"daprio/daprd:1.18.2","daprImageDigest":"sha256:dddddddddddddddddddddddddddddddddddddddddddddddddddddddddddddddd","kafkaImage":"apache/kafka:4.3.1","kafkaImageDigest":"sha256:eeeeeeeeeeeeeeeeeeeeeeeeeeeeeeeeeeeeeeeeeeeeeeeeeeeeeeeeeeeeeeee","kubectlImage":"registry.k8s.io/kubectl:v1.34.1","kubectlImageDigest":"sha256:ffffffffffffffffffffffffffffffffffffffffffffffffffffffffffffffff","kubectlVersion":"v1.34.1"},"schemaVersion":"1","startedUtc":"2026-08-30T00:00:00Z","teardown":{"commandExitCode":0,"containerCount":0,"imageCount":0,"networkCount":0,"temporaryDirectoryRemoved":true,"volumeCount":0},"topic":{"eventType":"com.gtx537.platform.contract-example.changed.v1","maxMessageBytes":1048576,"name":"cp6.platform.deployment-probe.v1","partitions":3,"retentionMs":3600000},"trace":{"eventId":"p09-event-0001","eventType":"com.gtx537.platform.contract-example.changed.v1","invocationTraceId":"44444444444444444444444444444444","invokedSpanId":"6666666666666666","invokerSpanId":"5555555555555555","partitionKey":"cp6-p09-entity-0001","publisherSpanId":"2222222222222222","receiverSpanId":"3333333333333333","topic":"cp6.platform.deployment-probe.v1","traceId":"11111111111111111111111111111111"}}